{
  "Locatie": "Groningen",
  "Deadline": "2025-10-18",
  "Notes": "Masterclass intake start 12-01-2026.",
  "Link": "https://www.werkenvoornederland.nl/vacatures/junior-test-engineer-DUO-2025-0194",
  "Salary": 3500,
  "Fit": "Strong",
  "Preference": 6.6,
  "Contact": "",
  "ContactNaam": "Alex Buitenwerf; Ruth Collé",
  "ContactPhone": "06-46111069; 06-21461559",
  "ContactJob": "Manager; Recruiter"
}