{
  "Locatie": "Groningen",
  "Deadline": null,
  "Notes": "1-year contract. Focus on Quality Assurance/Engineering.",
  "Link": "https://jobs.thermofisher.com/global/en/job/R-01332881/Quality-Engineer-III-1-year-contract",
  "Salary": 3000,
  "Fit": "Maybe",
  "Preference": 6,
  "Contact": "https://jobs.thermofisher.com/",
  "ContactNaam": "Thermo Fisher HR",
  "ContactPhone": "-",
  "ContactJob": "Recruiter"
}