{
  "Locatie": "Groningen",
  "Deadline": "",
  "Notes": "Rijbewijs B mogelijk vereist.",
  "Link": "https://banen-in-groningen.nl/vacature/python-software-engineer-cimsolutions-groningen/",
  "Salary": 4000,
  "Fit": "Stretch",
  "Preference": 6.8,
  "Contact": "recruitment@cimsolutions.nl",
  "ContactNaam": "-",
  "ContactPhone": "0347-368100",
  "ContactJob": "Recruitment"
}