{
  "Locatie": "Groningen",
  "Deadline": "",
  "Notes": "Geen 2 jaar professionele ervaring of Azure/Cloud, wel Sql, sterk in python.",
  "Link": "https://careers.soprasteria.com/job/data-engineer-groningen-in-groningen-netherlands-jid-4310",
  "Salary": 3200,
  "Fit": "Stretch",
  "Preference": 8,
  "Contact": "",
  "ContactNaam": "Recruitment team",
  "ContactPhone": "",
  "ContactJob": "Recruitment"
}