{
  "Locatie": "Groningen",
  "Deadline": "2025-09-18",
  "Notes": "Lab + data; salaris lager.",
  "Link": "https://werkenbijumcg.nl/-/vacatures/analist-genoomdiagnostiek/10419-02s0009udp",
  "Salary": 3050,
  "Fit": "Strong",
  "Preference": 8.6,
  "Contact": "",
  "ContactNaam": "Gineke Drok",
  "ContactPhone": "06-52724582",
  "ContactJob": "Teamleider team Centraal"
}