{
  "Locatie": "Leeuwarden (hybride)",
  "Deadline": "",
  "Notes": "Min. 1 jaar als data-analist + PowerBI/Excel/SQL gevraagd; jij hebt Python + thesis.",
  "Link": "https://www.maandag.com/nl-nl/vacatures/it/vacature/data-analist-leeuwarden/22999",
  "Salary": 4050,
  "Fit": "Good",
  "Preference": 6.9,
  "Contact": "",
  "ContactNaam": "Max Scheelbeek",
  "ContactPhone": "06-23960436",
  "ContactJob": "Recruiter IT"
}