{
  "Locatie": "Groningen",
  "Deadline": "",
  "Notes": "Simpele taak, moet te doen zijn.",
  "Link": "https://www.werkenbijderdw.nl/vacatures/agile-analist--functioneel-ontwerper-1207036",
  "Salary": 3650,
  "Fit": "Good",
  "Preference": 6.6,
  "Contact": "",
  "ContactNaam": "André van Luijn",
  "ContactPhone": "+31 6 52077669",
  "ContactJob": "Vakgroepmanager ICT"
}