{
  "Locatie": "Haren",
  "Deadline": "",
  "Notes": "Bit of Selenium; wel sterke Python en bughunting.",
  "Link": "https://apply.workable.com/cropx/j/2201D0817C/",
  "Salary": 3200,
  "Fit": "Maybe",
  "Preference": 8,
  "Contact": "info.nl@cropx.com",
  "ContactNaam": "",
  "ContactPhone": "-",
  "ContactJob": ""
}