{
  "Locatie": "Groningen",
  "Deadline": "2025-09-19",
  "Notes": "Header 20 Sep; details zeggen t/m 19 Sep — hanteer 19 Sep.",
  "Link": "https://www.werkenvoornederland.nl/vacatures/medewerker-kwaliteit-en-servicemanagement-bij-odc-noord-DUO-2025-0191",
  "Salary": 3500,
  "Fit": "Good",
  "Preference": 6.2,
  "Contact": "",
  "ContactNaam": "Reinder Datema; Ruth Collé",
  "ContactPhone": "06-21474034; 06-21461559",
  "ContactJob": "Manager; Recruiter"
}