{
  "Locatie": "Rotterdam (Hybrid)",
  "Deadline": null,
  "Notes": "AI Engineer role. Note: Rotterdam is far, check hybrid policy (60% office mentioned).",
  "Link": "https://jobs.dnv.com/job-search/business-assurance/it-and-software/rotterdam-netherlands/ai-engineer/300001357013968",
  "Salary": null,
  "Fit": "Good",
  "Preference": 7,
  "Contact": "recruitment@dnv.com",
  "ContactNaam": "Recruitment DNV",
  "ContactPhone": "+31507009700",
  "ContactJob": "HR"
}