{
  "Locatie": "Groningen",
  "Deadline": null,
  "Notes": "Specific testing role vacancy (ID J1025-0061).",
  "Link": "https://cgi.njoyn.com/corp/xweb/xweb.asp?NTKN=c&clid=21001&Page=JobDetails&Jobid=J1025-0061&BRID=1238721&lang=1",
  "Salary": 2900,
  "Fit": "Good",
  "Preference": 7,
  "Contact": "joost.van.keulen@cgi.com",
  "ContactNaam": "Joost van Keulen",
  "ContactPhone": "+31652824941",
  "ContactJob": "Director Consulting Services"
}