{
  "Locatie": "Groningen",
  "Deadline": "2026-01-15",
  "Notes": "Strong chemistry match. Focus on HPLC/LC-MS.",
  "Link": "https://symeres.com/vacancy/analytical-chemistry-technician/",
  "Salary": 3100,
  "Fit": 10,
  "Preference": 8,
  "Contact": "recruitment@symeres.com, rutger.folmer@symeres.com",
  "ContactNaam": "Rutger Folmer",
  "ContactPhone": "",
  "ContactJob": "Director Analytical Chemistry"
}