{
  "Locatie": "Groningen",
  "Deadline": null,
  "Notes": "Requires C++ (Tom focuses on Python); Robotics focus; Open until filled.",
  "Link": "https://www.xparvision.com/job/software-engineer/",
  "Salary": 3300,
  "Fit": "Stretch",
  "Preference": 6,
  "Contact": "recruitment@xparvision.com",
  "ContactNaam": "XPAR Vision",
  "ContactPhone": "",
  "ContactJob": "HR/Recruitment"
}