{
  "Locatie": "Groningen",
  "Deadline": "2025-11-23",
  "Notes": "Requires precise medical lab protocols; explicit deadline Nov 23.",
  "Link": "https://werkenbijumcg.nl/-/vacatures/analist-2a-laboratorium-bindingsanalyse/10419-02s0009zkp",
  "Salary": 3200,
  "Fit": "Strong",
  "Preference": 9,
  "Contact": "(050) 361 1576",
  "ContactNaam": "Jacob de Groot, Anneke Muller Kobold",
  "ContactPhone": "(050) 361 1576",
  "ContactJob": "laboratoriummanagers"
}