{
  "Locatie": "Groningen",
  "Deadline": "",
  "Notes": "Solicitatie verlopen",
  "Link": "https://springernature.wd3.myworkdayjobs.com/en-US/SpringerNatureCareers/job/Groningen/ML-Engineer_JR104058",
  "Salary": 3200,
  "Fit": "Maybe",
  "Preference": 8.4,
  "Contact": "",
  "ContactNaam": "Not listed",
  "ContactPhone": "",
  "ContactJob": "Recruitment"
}