{
  "Locatie": "Groningen (Detachment)",
  "Deadline": null,
  "Notes": "Rolling intake. Program includes post-master at TU Eindhoven. 3-year commitment.",
  "Link": "https://www.houseofbeta.nl/traineeships/mastership-data-science-ai/",
  "Salary": 3000,
  "Fit": "Strong",
  "Preference": 9,
  "Contact": "recruitment@houseofbeta.nl",
  "ContactNaam": "House of Bèta Recruitment",
  "ContactPhone": "",
  "ContactJob": "Recruitment"
}