{
  "Locatie": "Flexible / Hybrid",
  "Deadline": "2025-12-07",
  "Notes": "Werk in Assen, 26 November in Drachten een informatie bijeenkomst, 18:30-20:00 uur.",
  "Link": "https://kombijde.politie.nl/vacatures/digitaal-specialist---districtsrecherche_1226864.html",
  "Salary": 3200,
  "Fit": "Strong",
  "Preference": 9,
  "Contact": "peter.j.de.jong@politie.nl, roy.prinsen@politie.nl, willy.van.middelaar@politie.nl",
  "ContactNaam": "Peter J. de Jong, Roy Prinsen, Willy van Middelaar",
  "ContactPhone": "-, 06 31761983, 06 18658865",
  "ContactJob": "Operationeel Specialist, Recruiter"
}