{
  "Locatie": "Groningen",
  "Deadline": null,
  "Notes": "MBO level role; involves shift work and on-call duty. Vermelding PT 25-09",
  "Link": "https://www.polyvation.com/careers/process-technician-2/",
  "Salary": null,
  "Fit": "Maybe",
  "Preference": 6,
  "Contact": "info@polyvation.com",
  "ContactNaam": "Danijela Jovanovic",
  "ContactPhone": "",
  "ContactJob": "Recruitment Email"
}