{
  "Locatie": "Menlo Park, CA or Montreal, Canada; San Francisco planned",
  "Deadline": null,
  "Notes": "Research Scientist, Data. Own scientific-AI evaluations, external and experimental datasets, RL environments, and training-data pipelines. Office-based; relocation assistance and visa sponsorship available.",
  "Link": "https://jobs.ashbyhq.com/periodic-labs/d039ec58-a97d-47e1-b1e5-db003d772f77",
  "Salary": null,
  "Fit": 8.5,
  "Preference": 10,
  "Contact": "",
  "ContactNaam": "",
  "ContactPhone": "",
  "ContactJob": ""
}
