{
  "Locatie": "Groningen",
  "Deadline": "2025-11-30",
  "Notes": "Research role, fits academic background. Theme: Gedrag & Duurzaamheid.",
  "Link": "https://werkenbijhanze.nl/ad/junior-onderzoeker-communication-behaviour-and-sustainable-society/gwt22v",
  "Salary": 3200,
  "Fit": 8.0,
  "Preference": 8,
  "Contact": "s.p.elbert@pl.hanze.nl",
  "ContactNaam": "Sarah Elbert",
  "ContactPhone": "050 595 6875",
  "ContactJob": "onderzoeker CBSS"
}