{
  "Locatie": "Groningen",
  "Deadline": "",
  "Notes": "Minder ervaring met moderne QA-automation tools; wel bekend met grote webapps.",
  "Link": "https://scisure.homerun.co/qa-engineer/en",
  "Salary": 3150,
  "Fit": "Maybe",
  "Preference": 7.3,
  "Contact": "",
  "ContactNaam": "Groningen Office",
  "ContactPhone": "+31 5 07200055",
  "ContactJob": ""
}