{
  "Locatie": "Groningen",
  "Deadline": "Rolling / None",
  "Notes": "Chemistry of Life + ML sluit goed aan; vraag over fit zonder Biologie-diploma.",
  "Link": "https://www.makeitinthenorth.nl/jobs/umcg/biologist-statistics-applied-bioinformatics-computational-biology/",
  "Salary": 3500,
  "Fit": "Good",
  "Preference": 8.2,
  "Contact": "",
  "ContactNaam": "Not listed",
  "ContactPhone": "",
  "ContactJob": "Hiring team (Cardiology)"
}