{
  "Locatie": "Groningen",
  "Deadline": "",
  "Notes": "Heb alle SKILLS!",
  "Link": "https://datanorth.ai/vacancy/medior-ai-consultant",
  "Salary": 3400,
  "Fit": "Strong",
  "Preference": 9.0,
  "Contact": "menno@datanorth.ai",
  "ContactNaam": "Menno Fokkema",
  "ContactPhone": "+31 6 29051806",
  "ContactJob": "Senior Recruiter"
}