{
  "Locatie": "Delfzijl",
  "Deadline": "",
  "Notes": "MBO vereist; ik ben WO. Gericht naar WO-geschikte data/chemie rollen nog vragen.",
  "Link": "https://careers.teijinaramid.com/ad/chemisch-analist/kxpiwf/nl",
  "Salary": 3500,
  "Fit": "Stretch",
  "Preference": 8.2,
  "Contact": "",
  "ContactNaam": "Armant Reitsema; Gerwin Noij",
  "ContactPhone": "",
  "ContactJob": "Manager Laboratory; Recruiter"
}